{
  "schema_version": 1,
  "hero": "Jules",
  "season": 13,
  "last_updated": "2026-05-18",
  "notes": "POC SEED SKELETON - empty initial catalog used to prove the automated builds pipeline can generate an initial Jules catalog from source evidence. Not curator-authored content.",
  "item_tier_list": {
    "description": "Placeholder tier list for the Jules PoC seed; populated by curator review.",
    "S": [],
    "A": [],
    "B": [],
    "C": [],
    "D": [],
    "F": []
  },
  "game_phases": {
    "early": {
      "day_range": "Day 1-4",
      "description": "Placeholder early-phase description for the Jules PoC seed.",
      "universal_utility_items": [],
      "economy_items": []
    },
    "early_mid": {
      "day_range": "Day 4-7",
      "description": "Placeholder early-mid description for the Jules PoC seed.",
      "archetypes": []
    },
    "late": {
      "day_range": "Day 7-13",
      "description": "Placeholder late-phase description for the Jules PoC seed.",
      "archetypes": [
        {
          "name": "Zarlic / Spice Rack / Instant Noodles",
          "phase": "late",
          "core_items": [
            "Instant Noodles",
            "Spice Rack"
          ],
          "carry_items": [
            "Zarlic"
          ],
          "support_items": [
            "Basket",
            "Black Pepper",
            "Caviar",
            "Meat Tenderizer",
            "Serving Platter",
            "Sorbet",
            "Spatula"
          ]
        },
        {
          "name": "Freezer",
          "phase": "late",
          "carry_items": [],
          "support_items": [
            "Blender",
            "Walk-In Freezer"
          ]
        },
        {
          "name": "Farmer's Market / Bread Knife / Pasta",
          "phase": "late",
          "core_items": [
            "Bread Knife",
            "Farmer's Market",
            "Pasta"
          ],
          "carry_items": [],
          "support_items": [
            "Veggie Garden"
          ]
        },
        {
          "name": "Zarlic / Meat Tenderizer / Sorbet",
          "phase": "late",
          "carry_items": [],
          "support_items": [
            "Froyo Cart"
          ]
        },
        {
          "name": "Farmer's Market",
          "phase": "late",
          "carry_items": [],
          "support_items": [
            "Oven"
          ]
        },
        {
          "name": "Spice Rack",
          "phase": "late",
          "carry_items": [],
          "support_items": [
            "Pizza"
          ]
        }
      ]
    }
  }
}
