{
  "schema_version": 1,
  "hero": "Stelle",
  "season": 13,
  "last_updated": "2026-05-18",
  "notes": "POC SEED SKELETON - empty initial catalog used to prove the automated builds pipeline can generate an initial Stelle catalog from source evidence. Not curator-authored content.",
  "item_tier_list": {
    "description": "Placeholder tier list for the Stelle PoC seed; populated by curator review.",
    "S": [],
    "A": [],
    "B": [],
    "C": [],
    "D": [],
    "F": []
  },
  "game_phases": {
    "early": {
      "day_range": "Day 1-4",
      "description": "Placeholder early-phase description for the Stelle PoC seed.",
      "universal_utility_items": [],
      "economy_items": []
    },
    "early_mid": {
      "day_range": "Day 4-7",
      "description": "Placeholder early-mid description for the Stelle PoC seed.",
      "archetypes": []
    },
    "late": {
      "day_range": "Day 7-13",
      "description": "Placeholder late-phase description for the Stelle PoC seed.",
      "archetypes": [
        {
          "name": "Repair Drone / Buster / Freefall Simulator",
          "phase": "late",
          "core_items": [
            "Buster",
            "Freefall Simulator",
            "Repair Drone"
          ],
          "carry_items": [],
          "support_items": [
            "Parts Picker",
            "Pogo Stick"
          ]
        },
        {
          "name": "Chicken Cannon",
          "phase": "late",
          "core_items": [
            "Windbreaker"
          ],
          "carry_items": [
            "Chicken Cannon"
          ],
          "support_items": [
            "Radar Dome"
          ]
        },
        {
          "name": "Sirens / Observatory / Ornithopter",
          "phase": "late",
          "core_items": [
            "Observatory",
            "Ornithopter"
          ],
          "carry_items": [
            "Sirens"
          ],
          "support_items": [
            "Goggles",
            "Space Laser"
          ]
        },
        {
          "name": "Private Runabout",
          "phase": "late",
          "core_items": [
            "Launch Tower"
          ],
          "carry_items": [
            "Private Runabout"
          ],
          "support_items": [
            "Jetpack"
          ]
        },
        {
          "name": "LavaRoller",
          "phase": "late",
          "carry_items": [
            "LavaRoller"
          ],
          "support_items": [
            "Ni-Kola"
          ]
        }
      ]
    }
  }
}
